{
  "datapath_candidates": [
    {
      "path": "Option A",
      "engine_dirs": [
        "Meshes"
      ],
      "plugins": [
        {
          "name": "A.esp",
          "masters": [],
          "error": "not a TES3 plugin (missing TES3 header record)"
        }
      ]
    },
    {
      "path": "Option B",
      "engine_dirs": [
        "Meshes"
      ],
      "plugins": [
        {
          "name": "B.esp",
          "masters": [],
          "error": "not a TES3 plugin (missing TES3 header record)"
        }
      ]
    }
  ],
  "fomod": {
    "module_name": "Fixture FOMOD",
    "base": "",
    "module_image": "fomod/Banner.PNG",
    "required_files": [],
    "steps": [
      {
        "name": "Pick a variant",
        "visible": null,
        "groups": [
          {
            "name": "Variant",
            "kind": "select_exactly_one",
            "options": [
              {
                "name": "A",
                "description": "The first variant",
                "default_type": "recommended",
                "type_patterns": [],
                "sets_flags": [],
                "files": [
                  {
                    "source": "Option A",
                    "destination": "",
                    "is_folder": true,
                    "priority": 0
                  }
                ],
                "image": "fomod/banner.png"
              },
              {
                "name": "B",
                "description": "The second variant\r\n\r\nUse this one if you also use the Example mod.\r\nIt avoids changing the same records.",
                "default_type": "optional",
                "type_patterns": [],
                "sets_flags": [],
                "files": [
                  {
                    "source": "Option B",
                    "destination": "",
                    "is_folder": true,
                    "priority": 0
                  }
                ],
                "image": null
              }
            ]
          }
        ]
      }
    ],
    "conditional_installs": []
  },
  "notes": {
    "info": null,
    "documents": []
  },
  "warnings": [
    {
      "kind": "fomod",
      "path": "fomod"
    },
    {
      "kind": "multiple_candidates",
      "count": 2
    }
  ]
}
